{"baseRevision":"3b9c1e59698c3f1addd85363c360c483de9dafb5","evidence":[{"blobOid":"16a6c243666c8a4bc721399d6965c8e5de2f4251","id":"evidence:sha256:ffd1136736d8df8cfab717d2f21a06cc40e33b700d7bb3733e24d61c4a9683c8","path":"spec.txt","span":{"end":10,"start":0},"spanSha256":"d96ad4bcaadf727665c5675f69338d0f6c6acf6391733125e30e1820c8b94e98"}],"excludedPath":".corvint/change.cem.json","hunks":[{"basis":[],"disposition":"supported","id":"hunk:sha256:a1a9f8c035708e50d360170dfe13afb0ad22bdc7d27e417e59a87b2853723154","newRange":{"count":5,"start":3},"oldRange":{"count":5,"start":3},"path":"app.go","reason":"evidence-backed"}],"patchSha256":"eed002d72649ccbcaa444a16316eba2225a67dd7ee39cf930c02ea93a8bc5794","spec":"cem/0.3"}