{"baseRevision":"131b1b5cfb8a31a7c18b5951ca9a1b40889ead9b4564f35488000376fad75cf0","evidence":[],"excludedPath":".corvint/change.cem.json","hunks":[{"basis":[],"disposition":"unknown","id":"hunk:sha256:a1a9f8c035708e50d360170dfe13afb0ad22bdc7d27e417e59a87b2853723154","newRange":{"count":5,"start":3},"oldRange":{"count":5,"start":3},"path":"app.go","reason":"no-evidence"}],"patchSha256":"3cdd00f6da8d3d4e9d38671e0edce17cecd142f5f9718740133da6e91c09828d","spec":"cem/0.3"}