{"baseRevision":"016AF7EE8E162BC10D0F98DCD52B2319AC584C85","evidence":[],"excludedPath":".corvint/change.cem.json","hunks":[{"basis":[],"disposition":"unknown","id":"hunk:sha256:a1a9f8c035708e50d360170dfe13afb0ad22bdc7d27e417e59a87b2853723154","newRange":{"count":5,"start":3},"oldRange":{"count":5,"start":3},"path":"app.go","reason":"no-evidence"}],"patchSha256":"eed002d72649ccbcaa444a16316eba2225a67dd7ee39cf930c02ea93a8bc5794","spec":"cem/0.3"}